{
  "branch": "research/level2-energy-regime",
  "campaign_id": "level3-s6-truncation-extension-v1",
  "dimension": 248,
  "frozen_preregistration_commit": "1c19a01e051c3df6f547afe0816a795989fdac3b",
  "full_spectrum": true,
  "geometry": "triangle",
  "group_count": 53,
  "manifest_fingerprint": "2e0f06b69139abeb0b225a3d2b715242d6a0c26d2d1067b789f26b4829f847ca",
  "multiplet_entries": [
    {
      "a_qq": 1.0,
      "c_tt_conn": [
        [
          0.5009212304106951,
          -0.12546061520534768,
          -0.12546061520534751
        ],
        [
          -0.12546061520534768,
          0.5009212304106947,
          -0.1254606152053474
        ],
        [
          -0.12546061520534751,
          -0.1254606152053474,
          0.5009212304106951
        ]
      ],
      "energy": -3.8064854099851906,
      "epsilon": 3.1031188948412926e-16,
      "m_qq": {
        "reason": null,
        "value": 0.5
      },
      "m_tt": 0.12546061520534754,
      "multiplicity": 4,
      "q_end": 0.016129032258064516,
      "q_midpoint": 0.008064516129032258,
      "q_start": 0.0,
      "r_eff": {
        "reason": null,
        "value": 0.9317324075488589
      },
      "rho_qq": [
        {
          "i": 0,
          "j": 1,
          "null_reason": null,
          "value": -0.5000000000000002
        },
        {
          "i": 0,
          "j": 2,
          "null_reason": null,
          "value": -0.49999999999999967
        },
        {
          "i": 1,
          "j": 0,
          "null_reason": null,
          "value": -0.5000000000000002
        },
        {
          "i": 1,
          "j": 2,
          "null_reason": null,
          "value": -0.5000000000000002
        },
        {
          "i": 2,
          "j": 0,
          "null_reason": null,
          "value": -0.49999999999999967
        },
        {
          "i": 2,
          "j": 1,
          "null_reason": null,
          "value": -0.5000000000000002
        }
      ]
    },
    {
      "a_qq": 0.0,
      "c_tt_conn": [
        [
          0.75,
          0.25,
          0.2500000000000001
        ],
        [
          0.25,
          0.75,
          0.2500000000000001
        ],
        [
          0.2500000000000001,
          0.2500000000000001,
          0.75
        ]
      ],
      "energy": -1.6353240733352636,
      "epsilon": 0.037928031227003084,
      "m_qq": {
        "reason": "NO_NUMERIC_RHO_QQ_PAIR",
        "value": null
      },
      "m_tt": 0.25000000000000006,
      "multiplicity": 4,
      "q_end": 0.03225806451612903,
      "q_midpoint": 0.024193548387096774,
      "q_start": 0.016129032258064516,
      "r_eff": {
        "reason": null,
        "value": 0.9015991144200476
      },
      "rho_qq": [
        {
          "i": 0,
          "j": 1,
          "null_reason": "zero_local_charge_variance",
          "value": null
        },
        {
          "i": 0,
          "j": 2,
          "null_reason": "zero_local_charge_variance",
          "value": null
        },
        {
          "i": 1,
          "j": 0,
          "null_reason": "zero_local_charge_variance",
          "value": null
        },
        {
          "i": 1,
          "j": 2,
          "null_reason": "zero_local_charge_variance",
          "value": null
        },
        {
          "i": 2,
          "j": 0,
          "null_reason": "zero_local_charge_variance",
          "value": null
        },
        {
          "i": 2,
          "j": 1,
          "null_reason": "zero_local_charge_variance",
          "value": null
        }
      ]
    },
    {
      "a_qq": 1.0,
      "c_tt_conn": [
        [
          0.5168665664297747,
          -0.13343328321488712,
          -0.13343328321488707
        ],
        [
          -0.13343328321488712,
          0.5168665664297746,
          -0.13343328321488773
        ],
        [
          -0.13343328321488707,
          -0.13343328321488773,
          0.5168665664297749
        ]
      ],
      "energy": -1.5484015306792562,
      "epsilon": 0.03944648167862841,
      "m_qq": {
        "reason": null,
        "value": 0.5
      },
      "m_tt": 0.13343328321488732,
      "multiplicity": 4,
      "q_end": 0.04838709677419355,
      "q_midpoint": 0.04032258064516129,
      "q_start": 0.03225806451612903,
      "r_eff": {
        "reason": null,
        "value": 0.927261823829635
      },
      "rho_qq": [
        {
          "i": 0,
          "j": 1,
          "null_reason": null,
          "value": -0.5000000000000006
        },
        {
          "i": 0,
          "j": 2,
          "null_reason": null,
          "value": -0.4999999999999997
        },
        {
          "i": 1,
          "j": 0,
          "null_reason": null,
          "value": -0.5000000000000006
        },
        {
          "i": 1,
          "j": 2,
          "null_reason": null,
          "value": -0.4999999999999997
        },
        {
          "i": 2,
          "j": 0,
          "null_reason": null,
          "value": -0.4999999999999997
        },
        {
          "i": 2,
          "j": 1,
          "null_reason": null,
          "value": -0.4999999999999997
        }
      ]
    },
    {
      "a_qq": 1.0,
      "c_tt_conn": [
        [
          0.39945661670147153,
          -0.07472830835073573,
          -0.07472830835073586
        ],
        [
          -0.07472830835073573,
          0.39945661670147087,
          -0.07472830835073553
        ],
        [
          -0.07472830835073586,
          -0.07472830835073553,
          0.39945661670147203
        ]
      ],
      "energy": -1.231315572598988,
      "epsilon": 0.044985658301158526,
      "m_qq": {
        "reason": null,
        "value": 0.5
      },
      "m_tt": 0.0747283083507357,
      "multiplicity": 4,
      "q_end": 0.06451612903225806,
      "q_midpoint": 0.056451612903225805,
      "q_start": 0.04838709677419355,
      "r_eff": {
        "reason": null,
        "value": 0.9627620008732923
      },
      "rho_qq": [
        {
          "i": 0,
          "j": 1,
          "null_reason": null,
          "value": -0.5000000000000013
        },
        {
          "i": 0,
          "j": 2,
          "null_reason": null,
          "value": -0.49999999999999856
        },
        {
          "i": 1,
          "j": 0,
          "null_reason": null,
          "value": -0.5000000000000013
        },
        {
          "i": 1,
          "j": 2,
          "null_reason": null,
          "value": -0.5000000000000002
        },
        {
          "i": 2,
          "j": 0,
          "null_reason": null,
          "value": -0.49999999999999856
        },
        {
          "i": 2,
          "j": 1,
          "null_reason": null,
          "value": -0.5000000000000002
        }
      ]
    },
    {
      "a_qq": 1.0,
      "c_tt_conn": [
        [
          0.2500000000000021,
          -6.227116561141725e-29,
          -1.9485404402610412e-28
        ],
        [
          -6.227116561141725e-29,
          0.25000000000000105,
          -6.513860860819923e-29
        ],
        [
          -1.9485404402610412e-28,
          -6.513860860819923e-29,
          0.24999999999999795
        ]
      ],
      "energy": -0.27317126078433407,
      "epsilon": 0.0617234873906145,
      "m_qq": {
        "reason": null,
        "value": 0.49999999999999994
      },
      "m_tt": 1.239473475194792e-28,
      "multiplicity": 4,
      "q_end": 0.08064516129032258,
      "q_midpoint": 0.07258064516129031,
      "q_start": 0.06451612903225806,
      "r_eff": {
        "reason": null,
        "value": 0.9999999999999999
      },
      "rho_qq": [
        {
          "i": 0,
          "j": 1,
          "null_reason": null,
          "value": -0.49999999999999634
        },
        {
          "i": 0,
          "j": 2,
          "null_reason": null,
          "value": -0.500000000000001
        },
        {
          "i": 1,
          "j": 0,
          "null_reason": null,
          "value": -0.49999999999999634
        },
        {
          "i": 1,
          "j": 2,
          "null_reason": null,
          "value": -0.5000000000000026
        },
        {
          "i": 2,
          "j": 0,
          "null_reason": null,
          "value": -0.500000000000001
        },
        {
          "i": 2,
          "j": 1,
          "null_reason": null,
          "value": -0.5000000000000026
        }
      ]
    },
    {
      "a_qq": 1.0,
      "c_tt_conn": [
        [
          0.5239718546427904,
          -0.13698592732139572,
          -0.13698592732139664
        ],
        [
          -0.13698592732139572,
          0.5239718546427918,
          -0.13698592732139586
        ],
        [
          -0.13698592732139664,
          -0.13698592732139586,
          0.5239718546427942
        ]
      ],
      "energy": -0.12809520561352647,
      "epsilon": 0.06425782192298002,
      "m_qq": {
        "reason": null,
        "value": 0.5
      },
      "m_tt": 0.13698592732139608,
      "multiplicity": 4,
      "q_end": 0.0967741935483871,
      "q_midpoint": 0.08870967741935484,
      "q_start": 0.08064516129032258,
      "r_eff": {
        "reason": null,
        "value": 0.9253093980590434
      },
      "rho_qq": [
        {
          "i": 0,
          "j": 1,
          "null_reason": null,
          "value": -0.5000000000000067
        },
        {
          "i": 0,
          "j": 2,
          "null_reason": null,
          "value": -0.49999999999999944
        },
        {
          "i": 1,
          "j": 0,
          "null_reason": null,
          "value": -0.5000000000000067
        },
        {
          "i": 1,
          "j": 2,
          "null_reason": null,
          "value": -0.4999999999999941
        },
        {
          "i": 2,
          "j": 0,
          "null_reason": null,
          "value": -0.49999999999999944
        },
        {
          "i": 2,
          "j": 1,
          "null_reason": null,
          "value": -0.4999999999999941
        }
      ]
    },
    {